Name,Type 1,Type 2,HP,Attack,Defense,Sp. Atk,Sp. Def,Speed,Overall,Frames (F),Frames (B),Movepool
Bulbasaur,Grass,Poison,45,49,49,65,65,45,318,41,45,"Tackle, Growl, Vine Whip, Poison Powder, Sleep Powder, Take Down, Razor Leaf, Growth, Double-Edge, Synthesis, Seed Bomb, Work Up, Toxic, Venoshock, Hidden Power, Light Screen, Protect, Solar Beam, Sludge Bomb, Façade, Rest, Round, Echoed Voice, Energy Ball, Swords Dance, Swagger, Sleep Talk, Confide, Amnesia, Charm, Curse, Giga Drain, Grass Whistle, Ingrain, Leaf Storm, Magical Leaf, Petal Dance, Power Whip, Skull Bash, Sludge, Bind, Grass Pledge, Knock Off, Snore"
Ivysaur,Grass,Poison,60,62,63,80,80,60,405,49,53,"Tackle, Growl, Vine Whip, Poison Powder, Sleep Powder, Take Down, Razor Leaf, Growth, Double-Edge, Synthesis, Solar Beam, Work Up, Toxic, Venoshock, Hidden Power, Light Screen, Protect, Return, Sludge Bomb, Façade, Rest, Round, Echoed Voice, Energy Ball, Swords Dance, Swagger, Sleep Talk, Confide, Amnesia, Charm, Curse, Giga Drain, Grass Whistle, Ingrain, Leaf Storm, Magical Leaf, Petal Dance, Power Whip, Skull Bash, Sludge, Bind, Grass Pledge, Knock Off, Seed Bomb"
Venusaur,Grass,Poison,80,82,83,100,100,80,525,59,63,"Petal Dance, Tackle, Growl, Vine Whip, Poison Powder, Sleep Powder, Take Down, Razor Leaf, Sweet Scent, Growth, Double-Edge, Synthesis, Petal Blizzard, Solar Beam, Work Up, Toxic, Venoshock, Hidden Power, Hyper Beam, Light Screen, Protect, Solar Beam, Earthquake, Return, Sludge Bomb, Façade, Rest, Round, Echoed Voice, Energy Ball, Giga Impact, Swords Dance, Bulldoze, Sleep Talk, Confide, Amnesia, Charm, Curse, Giga Drain, Grass Whistle, Ingrain, Leaf Storm, Magical Leaf, Petal Dance, Power Whip, Skull Bash, Sludge, Seed Bomb, Bind, Frenzy Plant, Grass Pledge, Knock Off, Outrage, Snore, Stomping Tantrum"
Charmander,Fire,,39,52,43,60,50,65,309,34,38,"Scratch, Growl, Ember, Smokescreen, Dragon Rage, Scary Face, Fire Fang, Flame Burst, Slash, Flamethrower, Fire Spin, Inferno, Work Up, Dragon Claw, Toxic, Hidden Power, Protect, Brick Break, Flamethrower, Fire Blast, Rock Tomb, Aerial Ace, Facade, Flame Charge, Rest, Round, Echoed Voice, Overheat, Will-O-Wisp, Shadow Claw, Swords Dance, Rock Slide, Sleep Talk, Confide, Air Cutter, Ancient Power, Belly Drum, Bite, Crunch, Dragon Dance, Dragon Pulse, Dragon Rush, Flare Blitz, Focus Punch, Metal Claw, Outrage, Dragon Pulse, Fire Pledge, Fire Punch, Focus Punch, Heat Wave, Iron Tail, Snore, Thunder Punch"
Charmeleon,Fire,,58,64,58,90,65,80,415,59,63,"Scratch, Growl, Ember, Smokescreen, Dragon Rage, Scary Face, Fire Fang, Flame Burst, Slash, Flamethrower, Fire Spin, Inferno, Work Up, Dragon Claw, Toxic, Hidden Power, Protect, Brick Break, Flamethrower, Fire Blast, Rock Tomb, Aerial Ace, Facade, Flame Charge, Rest, Round, Echoed Voice, Overheat, Will-O-Wisp, Shadow Claw, Swords Dance, Rock Slide, Sleep Talk, Confide, Air Cutter, Ancient Power, Belly Drum, Bite, Crunch, Dragon Dance, Dragon Pulse, Dragon Rush, Flare Blitz, Focus Punch, Metal Claw, Outrage, Dragon Pulse, Fire Pledge, Fire Punch, Focus Punch, Heat Wave, Iron Tail, Snore, Thunder Punch"
Charizard,Fire,Flying,78,84,78,109,85,100,534,47,51,"Wing Attack, Heat Wave, Dragon Claw, Shadow Claw, Air Slash, Scratch, Growl, Ember, Smokescreen, Dragon Rage, Scary Face, Fire Fang, Flame Burst, Slash, Flamethrower, Fire Spin, Inferno, Work Up, Toxic, Hidden Power, Hyper Beam, Protect, Roost, Solar Beam, Earthquake, Brick Break, Flamethrower, Fire Blast, Rock Tomb, Aerial Ace, Facade, Flame Charge, Rest, Round, Echoed Voice, Overheat, Steel Wing, Focus Blast, Sky Drop, Brutal Swing, Will-O-Wisp, Shadow Claw, Giga Impact, Swords Dance, Fly, Bulldoze, Rock Slide, Dragon Tail, Sleep Talk, Confide, Air Cutter, Ancient Power, Belly Drum, Bite, Crunch, Dragon Dance, Dragon Pulse, Dragon Rush, Flare Blitz, Focus Punch, Metal Claw, Outrage, Blast Burn, Fire Pledge, Fire Punch, Focus Punch, Heat Wave, Iron Tail, Snore, Tailwind, Thunder Punch"
Squirtle,Water,,44,48,65,50,64,43,314,29,33,"Tackle, Tail Whip, Water Gun, Withdraw, Bubble, Bite, Rapid Spin, Protect, Water Pulse, Aqua Tail, Skull Bash, Iron Defense, Hydro Pump, Work Up, Toxic, Hidden Power, Ice Beam, Blizzard, Protect, Brick Break, Rock Tomb, Façade, Rest, Round, Scald, Sleep Talk, Surf, Waterfall, Confide, Aqua Jet, Aqua Ring, Aura Sphere, Brine, Dragon Pulse, Fake Out, Flail, Muddy Water, Refresh, Water Spout, Dragon Pulse, Focus Punch, Ice Punch, Icy Wind, Iron Defense, Iron Tail, Snore, Water Pledge, Zen Headbutt"
Wartortle,Water,,59,63,80,65,80,58,405,31,35,"Tackle, Tail Whip, Water Gun, Withdraw, Bubble, Bite, Rapid Spin, Protect, Water Pulse, Aqua Tail, Skull Bash, Iron Defense, Hydro Pump, Work Up, Toxic, Hidden Power, Ice Beam, Blizzard, Protect, Brick Break, Rock Tomb, Façade, Rest, Round, Scald, Sleep Talk, Surf, Waterfall, Confide, Aqua Jet, Aqua Ring, Aura Sphere, Brine, Dragon Pulse, Fake Out, Flail, Haze, Muddy Water, Refresh, Water Spout, Dragon Pulse, Focus Punch, Ice Punch, Icy Wind, Iron Defense, Iron Tail, Snore, Water Pledge, Zen Headbutt"
Blastoise,Water,,79,83,100,85,105,78,530,79,83,"Flash Cannon, Tackle, Tail Whip, Water Gun, Withdraw, Bubble, Bite, Rapid Spin, Protect, Water Pulse, Aqua Tail, Skull Bash, Iron Defense, Hydro Pump, Work Up, Toxic, Hidden Power, Ice Beam, Blizzard, Hyper Beam, Protect, Smack Down, Earthquake, Brick Break, Rock Tomb, Façade, Rest, Round, Focus Blast, Scald, Giga Impact, Bulldoze, Rock Slide, Dragon Tail, Sleep Talk, Surf, Dark Pulse, Waterfall, Confide, Aqua Jet, Aqua Ring, Aura Sphere, Brine, Dragon Pulse, Fake Out, Flail, Haze, Muddy Water, Refresh, Water Spout, Dragon Pulse, Focus Punch, Hydro Cannon, Ice Punch, Icy Wind, Iron Defense, Iron Tail, Liquidation, Outrage, Signal Beam, Snore, Water Pledge, Zen Headbutt"
Caterpie,Bug,,45,30,35,20,20,45,195,49,53,"Tackle, String Shot, Bug Bite, Electroweb, Snore"
Metapod,Bug,,50,20,55,25,25,30,205,60,63,"Harden, Bug Bite, Electroweb, Iron Defense, Tackle, String Shot, Bug Bite, Snore"
Butterfree,Bug,Flying,60,45,50,80,80,70,385,63,67,"Gust, Confusion, Poison Powder, Stun Spore, Sleep Powder, Psybeam, Silver Wind, Bug Buzz, Rage Powder, Captivate, Tailwind, Air Slash, Quiver Dance, Toxic, Venoshock, Hidden Power, Hyper Beam, Protect, Roost, Solar Beam, Psychic, Shadow Ball, Double Team, Aerial Ace, Facade, Rest, Round, Energy Ball, Acrobatics, Giga Impact, Psych Up, Infestation, Sleep Talk, U-turn, Confide"
Weedle,Bug,Poison,40,35,30,20,20,50,195,59,63,"Poison Sting, String Shot, Bug Bite, Electroweb"
Kakuna,Bug,Poison,45,25,50,25,25,35,205,74,78,"Poison Sting, String Shot, Bug Bite, Electroweb, Iron Defense, Harden"
Beedrill,Bug,Poison,65,90,40,45,80,75,395,120,123,"Twineedle, Fury Attack, Rage, Pursuit, Venoshock, Assurance, Toxic Spikes, Pin Missile, Poison Jab, Agility, Endeavor, Fell Stinger, Toxic, Venoshock, Hidden Power, Hyper Beam, Protect, Roost, Solar Beam, Brick Break, Double Team, Sludge Bomb, Aerial Ace, Facade, Rest, Round, Brutal Swing, Acrobatics, Payback, Giga Impact, Swords Dance, X-Scissor, Infestation, Poison Jab, Sleep Talk, U-turn, Confide, Bug Bite, Poison Sting, String Shot, Harden, Iron Defense, Drill Run, Electroweb, Giga Drain, Knock Off, Snore, Tailwind, Throat Chop"
Pidgey,Normal,Flying,40,45,40,35,35,56,251,24,27,"Tackle, Sand Attack, Gust, Quick Attack, Twister, Feather Dance, Agility, Wing Attack, Roost, Tailwind, Air Slash, Hurricane, Work Up, Toxic, Hidden Power, Protect, Roost, Double Team, Aerial Ace, Façade, Rest, Round, Fly, Sleep Talk, U-turn, Confide, Air Cutter, Brave Bird, Feint Attack, Pursuit, Steel Wing, Uproar, Heat Wave, Sky Attack, Snore"
Pidgeotto,Normal,Flying,63,60,55,50,50,71,349,20,23,"Tackle, Sand Attack, Gust, Quick Attack, Twister, Feather Dance, Agility, Wing Attack, Roost, Tailwind, Air Slash, Hurricane, Work Up, Toxic, Hidden Power, Protect, Roost, Double Team, Aerial Ace, Façade, Rest, Round, Fly, Sleep Talk, U-turn, Confide, Air Cutter, Brave Bird, Feint Attack, Pursuit, Steel Wing, Uproar, Heat Wave, Sky Attack, Snore"
Pidgeot,Normal,Flying,83,80,75,70,70,101,479,53,57,"Hurricane, Tackle, Sand Attack, Gust, Quick Attack, Twister, Feather Dance, Agility, Wing Attack, Roost, Tailwind, Air Slash, Work Up, Toxic, Hidden Power, Hyper Beam, Protect, Roost, Double Team, Aerial Ace, Façade, Rest, Round, Steel Wing, Giga Impact, Fly, Sleep Talk, U-turn, Confide, Air Cutter, Brave Bird, Feint Attack, Pursuit, Uproar, Heat Wave, Sky Attack, Snore"
Rattata,Normal,,30,56,35,25,35,72,253,25,25,"Tackle, Tail Whip, Quick Attack, Bite, Pursuit, Hyper Fang, Assurance, Crunch, Super Fang, Double-Edge, Endeavor, Work Up, Toxic, Hidden Power, Ice Beam, Blizzard, Protect, Thunderbolt, Thunder, Shadow Ball, Double Team, Façade, Rest, Round, Charge Beam, Thunder Wave, Sleep Talk, U-turn, Wild Charge, Confide, Flame Wheel, Fury Swipes, Revenge, Screech, Uproar, Covet, Icy Wind, Iron Tail, Shock Wave, Snore, Zen Headbutt"
Raticate,Normal,,55,81,60,50,70,97,413,61,61,"Swords Dance, Tackle, Tail Whip, Quick Attack, Scary Face, Bite, Pursuit, Hyper Fang, Assurance, Crunch, Super Fang, Double-Edge, Endeavor, Work Up, Toxic, Hidden Power, Ice Beam, Blizzard, Hyper Beam, Protect, Thunderbolt, Thunder, Shadow Ball, Double Team, Facade, Rest, Round, Charge Beam, Giga Impact, Thunder Wave, Sleep Talk, U-turn, Wild Charge, Confide"
Spearow,Normal,Flying,40,60,30,31,31,70,262,24,23,"Peck, Growl, Leer, Pursuit, Fury Attack, Aerial Ace, Mirror Move, Assurance, Agility, Roost, Drill Peck, Work Up, Toxic, Hidden Power, Protect, Double Team, Facade, Rest, Round, Echoed Voice, Steel Wing, Fly, Sleep Talk, U-turn, Confide, Astonish, Feather Dance, Feint Attack, Quick Attack, Razor Wind, Scary Face, Sky Attack, Steel Wing, Tri Attack, Uproar, Drill Run, Heat Wave, Snore, Tailwind"
Fearow,Normal,Flying,65,90,65,61,61,100,442,25,25,"Drill Run, Pluck, Peck, Growl, Leer, Pursuit, Fury Attack, Aerial Ace, Assurance, Agility, Roost, Drill Peck, Work Up, Toxic, Hidden Power, Hyper Beam, Protect, Roost, Double Team, Facade, Rest, Round, Echoed Voice, Steel Wing, False Swipe, Giga Impact, Fly, Swagger, Sleep Talk, U-turn, Substitute, Confide, Astonish, Feather Dance, Feint Attack, Quick Attack, Razor Wind, Scary Face, Sky Attack, Steel Wing, Tri Attack, Uproar, Whirlwind, Defog, Drill Run, Heat Wave, Sky Attack, Snore, Tailwind, Throat Chop"
Ekans,Poison,,35,60,44,40,54,55,288,48,47,"Wrap, Leer, Poison Sting, Bite, Glare, Screech, Acid, Stockpile, Swallow, Spit Up, Acid Spray, Mud Bomb, Gastro Acid, Haze, Coil, Gunk Shot,  Toxic, Venoshock, Hidden Power, Protect, Earthquake, Double Team, Sludge Wave, Sludge Bomb, Rock Tomb, Facade, Rest, Round, Brutal Swing, Payback, Bulldoze, Rock Slide, Infestation, Poison Jab, Sleep Talk, Dark Pulse, Confide, Iron Tail, Poison Fang, Poison Tail, Pursuit, Scary Face, Slam, Aqua Tail, Bind, Giga Drain, Seed Bomb, Snore"
Arbok,Poison,,60,95,69,65,79,80,448,80,83,"Crunch, Ice Fang, Thunder Fang, Fire Fang, Wrap, Leer, Poison Sting, Bite, Glare, Screech, Acid, Stockpile, Swallow, Spit Up, Acid Spray, Mud Bomb, Gastro Acid, Haze, Coil, Gunk Shot, Toxic, Venoshock, Hidden Power, Hyper Beam, Protect, Earthquake, Double Team, Sludge Wave, Sludge Bomb, Rock Tomb, Facade, Rest, Round, Brutal Swing, Payback, Giga Impact, Bulldoze, Rock Slide, Dragon Tail, Infestation, Poison Jab, Sleep Talk, Dark Pulse, Confide, Iron Tail, Poison Fang, Poison Tail, Pursuit, Scary Face, Slam, Aqua Tail, Bind, Giga Drain, Seed Bomb, Snore, Stomping Tantrum, Throat Chop"
Pikachu,Electric,,35,55,40,50,50,90,320,33,35,"Tail Whip, Thunder Shock, Growl, Play Nice, Quick Attack, Thunder Wave, Feint, Double Team, Spark, Nuzzle, Discharge, Slam, Thunderbolt, Agility, Wild Charge, Light Screen, Thunder, Toxic, Hidden Power, Protect, Brick Break, Facade, Rest, Round, Echoed Voice, Charge Beam, Volt Switch, Sleep Talk, Confide, Bide, Charge, Disarming Voice, Double Slap, Fake Out, Flail, Thunder Punch, Tickle, Volt Tackle, Covet, Electroweb, Focus Punch, Iron Tail, Knock Off, Shock Wave, Signal Beam, Snore"
Raichu,Electric,,60,90,55,90,80,110,485,29,33,"Thunder Shock, Tail Whip, Quick Attack, Thunderbolt, Toxic, Hidden Power, Hyper Beam, Light Screen, Protect, Thunder, Brick Break, Double Team, Facade, Rest, Round, Echoed Voice, Focus Blast, Charge Beam, Giga Impact, Volt Switch, Thunder Wave, Sleep Talk, Wild Charge, Confide, Bestow, Bide, Charge, Disarming Voice, Double Slap, Fake Out, Flail, Thunder Punch, Tickle, Volt Tackle, Covet, Electroweb, Focus Punch, Iron Tail, Knock Off, Shock Wave, Signal Beam, Snore"
Sandshrew,Ground,,50,75,85,20,30,40,300,30,29,"Scratch, Defense Curl, Sand Attack, Poison Sting, Rollout, Rapid Spin, Fury Cutter, Swift, Fury Swipes, Sand Tomb, Slash, Dig, Swords Dance, Earthquake, Toxic, Hidden Power, Protect, Brick Break, Double Team, Rock Tomb, Aerial Ace, Facade, Rest, Round, Shadow Claw, Bulldoze, Rock Slide, X-Scissor, Poison Jab, Sleep Talk, Confide, Chip Away, Crush Claw, Flail, Hone Claws, Metal Claw, Mud Shot, Night Slash, Rock Climb, Covet, Earth Power, Focus Punch, Iron Tail, Knock Off, Snore, Stealth Rock, Stomping Tantrum, Super Fang"
Sandslash,Ground,,75,100,110,45,55,65,450,48,51,"Crush Claw, Scratch, Defense Curl, Sand Attack, Poison Sting, Rollout, Rapid Spin, Fury Cutter, Swift, Fury Swipes, Sand Tomb, Slash, Dig, Swords Dance, Earthquake, Toxic, Hidden Power, Hyper Beam, Protect, Brick Break, Double Team, Rock Tomb, Aerial Ace, Facade, Rest, Round, Focus Blast, Shadow Claw, Giga Impact, Stone Edge, Bulldoze, Rock Slide, X-Scissor, Poison Jab, Sleep Talk, Confide, Chip Away, Flail, Hone Claws, Metal Claw, Mud Shot, Night Slash, Rapid Spin, Rock Climb, Covet, Earth Power, Focus Punch, Iron Tail, Knock Off, Snore, Stealth Rock, Stomping Tantrum, Super Fang"
Nidoran-F,Poison,,55,47,52,40,40,41,275,64,67,"Growl, Scratch, Tail Whip, Double Kick, Poison Sting, Fury Swipes, Bite, Toxic Spikes, Crunch, Captivate, Poison Fang, Toxic, Venoshock, Hidden Power, Ice Beam, Blizzard, Protect, Thunderbolt, Thunder,  Double Team, Sludge Bomb, Aerial Ace, Facade, Rest, Round, Echoed Voice, Shadow Claw, Poison Jab, Sleep Talk, Confide, Charm, Chip Away, Iron Tail, Poison Tail, Pursuit, Skull Bash, Take Down, Shock Wave, Snore, Super Fang, Water Pulse"
Nidorina,Poison,,70,62,67,55,55,56,365,40,43,"Growl, Scratch, Tail Whip, Double Kick, Poison Sting, Fury Swipes, Bite, Toxic Spikes, Crunch, Captivate, Poison Fang, Toxic, Venoshock, Hidden Power, Ice Beam, Blizzard, Protect, Thunderbolt, Thunder,  Double Team, Sludge Bomb, Aerial Ace, Facade, Rest, Round, Echoed Voice, Shadow Claw, Poison Jab, Sleep Talk, Confide, Charm, Chip Away, Iron Tail, Poison Tail, Pursuit, Skull Bash, Take Down, Shock Wave, Snore, Stomping Tantrum, Super Fang, Water Pulse"
Nidoqueen,Poison,Ground,90,92,87,75,85,76,505,50,53,"Superpower, Scratch, Tail Whip, Double Kick, Poison Sting, Chip Away, Body Slam, Earth Power, Toxic, Venoshock, Hidden Power, Ice Beam, Blizzard, Hyper Beam, Protect, Smack Down, Thunderbolt, Thunder, Earthquake, Shadow Ball, Brick Break, Double Team, Sludge Wave, Flamethrower, Sludge Bomb, Fire Blast, Rock Tomb, Aerial Ace, Facade, Rest, Round, Echoed Voice, Focus Blast, Shadow Claw, Giga Impact, Stone Edge Bulldoze, Rock Slide, Dragon Tail, Poison Jab, Sleep Talk, Surf, Confide, Charm, Iron Tail, Poison Tail, Pursuit, Skull Bash, Take Down, Aqua Tail, Dragon Pulse, Drill Run, Fire Punch, Focus Punch, Ice Punch, Icy Wind, Outrage, Shock Wave, Snore, Stealth Rock, Stomping Tantrum, Super Fang, Throat Chop, Thunder Punch, Uproar, Water Pulse"
Nidoran-M,Poison,,46,57,40,40,40,50,273,50,53,"Leer, Peck, Double Kick, Poison Sting, Fury Attack, Horn Attack, Toxic Spikes, Poison Jab, Captivate, Horn Drill, Toxic, Venoshock, Hidden Power, Ice Beam, Blizzard, Protect, Thunderbolt, Thunder, Double Team, Sludge Bomb, Facade, Rest, Round, Echoed Voice, Shadow Claw, Smart Strike, Sleep Talk, Confide, Amnesia, Chip Away, Confusion, Head Smash, Iron Tail, Poison Tail, Take Down, Drill Run, Shock Wave, Snore, Super Fang, Water Pulse"
Nidorino,Poison,,61,72,57,55,55,65,365,50,53,"Leer, Peck, Double Kick, Poison Sting, Fury Attack, Horn Attack, Toxic Spikes, Poison Jab, Captivate, Horn Drill, Toxic, Venoshock, Hidden Power, Ice Beam, Blizzard, Protect, Thunderbolt, Thunder, Double Team, Sludge Bomb, Facade, Rest, Round, Echoed Voice, Shadow Claw, Smart Strike, Sleep Talk, Confide, Amnesia, Chip Away, Confusion, Head Smash, Iron Tail, Poison Tail, Take Down, Drill Run, Shock Wave, Snore, Stomping Tantrum, Super Fang, Water Pulse"
Nidoking,Poison,Ground,81,102,77,85,75,85,505,42,45,"Megahorn, Peck, Double Kick, Poison Sting, Chip Away, Thrash, Earth Power, Toxic, Venoshock, Hidden Power, Ice Beam, Blizzard, Hyper Beam, Protect, Smack Down, Thunderbolt, Thunder, Earthquake, Shadow Ball, Brick Break, Double Team, Sludge Wave, Flamethrower, Sludge Bomb, Fire Blast, Rock Tomb, Facade, Rest, Round, Echoed Voice, Focus Blast, Shadow Claw, Smart Strike, Giga Impact, Stone Edge, Bulldoze, Rock Slide, Dragon Tail, Poison Jab, Sleep Talk, Surf, Confide, Amnesia, Confusion, Head Smash, Iron Tail, Poison Tail, Take Down, Aqua Tail, Dragon Pulse, Drill Run, Fire Punch, Focus Punch, Ice Punch, Icy Wind, Outrage, Shock Wave, Snore, Stealth Rock, Stomping Tantrum, Super Fang, Superpower, Throat Chop, Thunder Punch, Uproar, Water Pulse"
Clefairy,Fairy,,70,45,48,60,65,35,323,40,39,"Disarming Voice, Pound,Growl, Sing, Double Slap, Defense Curl, Wake-Up Slap, Minimize, Stored Power, Metronome, Cosmic Power, Body Slam, Moonlight, Moonblast, Meteor Mash, Healing, Work Up, Psyshock, Calm Mind, Toxic, Hidden Power, Ice Beam, Blizzard, Light Screen, Protect, Solar Beam, Thunderbolt, Thunder, Psychic, Shadow Ball, Brick Break, Double Team, Reflect, Flamethrower, Fire Blast, Facade, Rest, Round, Echoed Voice, Charge Beam, Thunder Wave, Psych Up, Sleep Talk, Dazzling Gleam, Confide, Amnesia, Aromatherapy, Belly Drum, Fake Tears, Splash, Tickle, Bounce, Covet, Drain Punch, Endeavor, Fire Punch, Focus Punch, Hyper Voice, Ice Punch, Icy Wind, Iron Tail, Knock Off, Shock Wave, Signal Beam, Snore, Stealth Rock, Thunder Punch, Water Pulse, Zen Headbutt"
Clefable,Fairy,,95,70,73,95,90,60,483,40,43,"Disarming Voice, Sing, Double Slap, Minimize, Metronome, Work Up, Psyshock, Calm Mind, Toxic, Hidden Power, Ice Beam, Blizzard, Hyper Beam, Light Screen, Protect, Solar Beam, Thunderbolt, Thunder, Psychic, Shadow Ball, Brick Break, Double Team, Reflect, Flamethrower, Fire Blast, Facade, Rest, Round, Echoed Voice, Focus Blast, Charge Beam, Thunder Wave, Psych Up, Sleep Talk, Dazzling Gleam, Confide, Amnesia, Aromatherapy, Belly Drum, Fake Tears, Splash, Stored Power, Tickle, Bounce, Covet, Drain Punch, Endeavor, Fire Punch, Focus Punch, Hyper Voice, Ice Punch, Icy Wind, Iron Tail, Knock Off, Shock Wave, Signal Beam, Snore, Stealth Rock, Thunder Punch, Water Pulse, Zen Headbutt"
Vulpix,Fire,,38,41,40,50,65,65,299,40,39,"Ember, Tail Whip, Baby-Doll Eyes, Quick Attack, Fire Spin, Will-O-Wisp, Feint Attack, Hex, Flame Burst, Extrasensory, Flamethrower, Fire Blast, Captivate, Inferno, Toxic, Hidden Power, Protect, Double Team, Facade, Flame Charge, Rest, Round, Overheat, Energy Ball, Payback, Psych Up, Sleep Talk, Dark Pulse, Confide, Flail, Flare Blitz, Heat Wave, Howl, Hypnosis, Power Swap, Tail Slap, Covet, Iron Tail, Snore, Zen Headbutt"
Ninetales,Fire,,73,76,75,81,100,100,505,59,63,"Nasty Plot, Flamethrower, Quick Attack, Psyshock, Calm Mind, Toxic, Hidden Power, Hyper Beam, Protect, Solar Beam, Double Team, Fire Blast, Facade, Flame Charge, Rest, Round, Overheat, Energy Ball, Will-O-Wisp, Payback, Giga Impact, Psych Up, Sleep Talk, Dark Pulse, Confide, Captivate, Extrasensory, Flail, Feint Attack, Flare Blitz, Heat Wave, Hex, Howl, Hypnosis, Power Swap, Tail Slap, Covet, Iron Tail, Snore, Zen Headbutt"
Jigglypuff,Normal,Fairy,115,45,20,45,25,20,270,49,53,"Sing, Defense Curl, Pound, Play Nice, Disarming Voice, Double Slap, Rollout, Round, Stockpile, Wake-Up Slap, Rest, Body Slam, Hyper Voice, Double-Edge, Work Up, Toxic, Hidden Power, Ice Beam, Blizzard, Light Screen, Protect, Solar Beam, Thunderbolt, Thunder, Psychic, Shadow Ball, Brick Break, Double Team, Reflect, Flamethrower, Fire Blast, Facade, Rest, Round, Echoed Voice, Charge Beam, Thunder Wave, Psych Up, Sleep Talk, Wild Charge, Dazzling Gleam, Confide, Captivate, Covet, Fake Tears, Feint Attack, Bounce, Drain Punch, Endeavor, Fire Punch, Focus Punch, Ice Punch, Icy Wind, Knock Off, Shock Wave, Stealth Rock, Snore, Thunder Punch, Water Pulse, Charm, Uproar"
Wigglytuff,Normal,Fairy,140,70,45,85,50,45,435,60,59,"Double-Edge, Play Rough, Sing, Defense Curl, Double Slap, Work Up, Toxic, Hidden Power, Ice Beam, Blizzard, Hyper Beam, Light Screen, Protect, Solar Beam, Thunderbolt, Thunder, Psychic, Shadow Ball, Brick Break, Double Team, Reflect, Flamethrower, Fire Blast, Facade, Rest, Round, Echoed Voice, Focus Blast, Charge Beam, Giga Impact, Thunder Wave, Psych Up, Sleep Talk, Wild Charge, Dazzling Gleam, Confide, Captivate, Covet, Fake Tears, Feint Attack, Bounce, Drain Punch, Endeavor, Fire Punch, Focus Punch, Hyper Voice, Ice Punch, Icy Wind, Knock Off,  Shock Wave, Snore, Stealth Rock, Thunder Punch, Water Pulse"
Zubat,Poison,Flying,40,45,35,30,40,55,245,39,43,"Absorb, Astonish, Bite, Wing Attack, Air Cutter, Swift, Poison Fang, Leech Life, Haze, Venoshock, Air Slash, Quick Guard, Toxic, Hidden Power, Protect, Roost, Leech Life, Shadow Ball, Double Team, Sludge Bomb, Aerial Ace, Façade, Rest, Round, Steel Wing, Acrobatics, Payback, Fly, Sleep Talk, U-turn, Confide, Brave Bird, Curse, Defog, Feint Attack, Giga Drain, Gust, Hypnosis, Nasty Plot, Pursuit, Quick Attack, Steel Wing, Zen Headbutt, Heat Wave, Snore, Super Fang, Tailwind, Uproar"
Golbat,Poison,Flying,75,80,70,65,75,90,455,59,63,"Screech, Absorb, Astonish, Bite, Wing Attack, Air Cutter, Swift, Poison Fang, Leech Life, Haze, Venoshock, Air Slash, Quick Guard, Toxic, Hidden Power, Hyper Beam, Protect, Roost, Leech Life, Shadow Ball, Double Team, Sludge Bomb, Aerial Ace, Façade, Rest, Round, Steel Wing, Acrobatics, Payback, Giga Impact, Fly, Sleep Talk, U-turn, Confide, Brave Bird, Curse, Defog, Feint Attack, Giga Drain, Gust, Hypnosis, Nasty Plot, Pursuit, Quick Attack, Steel Wing, Heat Wave, Snore, Super Fang, Tailwind, Zen Headbutt, Uproar"
Oddish,Grass,Poison,45,50,55,75,65,30,320,50,53,"Absorb, Growth, Sweet Scent, Acid, Poison Powder, Stun Spore, Sleep Powder, Mega Drain, Moonlight, Giga Drain, Toxic, Moonblast, Petal Dance, Toxic, Venoshock, Hidden Power, Protect, Solar Beam, Double Team, Sludge Bomb, Façade, Rest, Round, Energy Ball, Swords Dance, Infestation, Sleep Talk, Dazzling Gleam, Confide, Charm, Flail, Ingrain, Razor Leaf, Synthesis, Teeter Dance, Tickle, Gastro Acid, Seed Bomb, Snore"
Gloom,Grass,Poison,60,65,70,85,75,40,395,37,41,"Absorb, Growth, Sweet Scent, Acid, Poison Powder, Stun Spore, Sleep Powder, Mega Drain, Moonlight, Giga Drain, Toxic, Moonblast, Petal Blizzard, Petal Dance, Toxic, Venoshock, Hidden Power, Protect, Solar Beam, Double Team, Sludge Bomb, Façade, Rest, Round, Energy Ball, Swords Dance, Infestation, Sleep Talk, Dazzling Gleam, Confide, Charm, Flail, Ingrain, Razor Leaf, Synthesis, Teeter Dance, Tickle, Gastro Acid, Seed Bomb, Snore, Drain Punch"
Vileplume,Grass,Poison,75,80,85,110,90,50,490,28,32,"Absorb, Growth, Sweet Scent, Acid, Poison Powder, Stun Spore, Sleep Powder, Mega Drain, Moonlight, Giga Drain, Toxic, Moonblast, Petal Blizzard, Petal Dance, Toxic, Venoshock, Hidden Power, Protect, Solar Beam, Double Team, Sludge Bomb, Façade, Rest, Round, Energy Ball, Swords Dance, Infestation, Sleep Talk, Dazzling Gleam, Confide, Charm, Flail, Ingrain, Razor Leaf, Synthesis, Teeter Dance, Tickle, Gastro Acid, Seed Bomb, Snore, Drain Punch, Aromatherapy, Hyper Beam, Giga Impact"
Paras,Bug,Grass,35,70,55,45,55,25,285,40,39,"Scratch, Stun Spore, Poison Powder, Absorb, Fury Cutter, Spore, Slash, Growth, Giga Drain, Aromatherapy, X-Scissor, Toxic, Venoshock, Hidden Power, Light Screen, Protect, Solar Beam, Leech Life, Brick Break, Double Team, Sludge Bomb, Aerial Ace, Façade, Rest, Round, Energy Ball, Swords Dance, Sleep Talk, Confide, Agility, Bug Bite, Cross Poison, Fell Stinger, Flail, Metal Claw, Psybeam, Pursuit, Screech, Sweet Scent, Knock Off, Seed Bomb, Snore, Synthesis"
Parasect,Bug,Grass,60,95,80,60,80,30,405,60,59,"Scratch, Stun Spore, Poison Powder, Absorb, Fury Cutter, Spore, Slash, Growth, Giga Drain, Aromatherapy, X-Scissor, Toxic, Venoshock, Hidden Power, Light Screen, Protect, Solar Beam, Leech Life, Brick Break, Double Team, Sludge Bomb, Aerial Ace, Façade, Rest, Round, Energy Ball, Swords Dance, Sleep Talk, Confide, Agility, Bug Bite, Cross Poison, Fell Stinger, Flail, Metal Claw, Psybeam, Pursuit, Screech, Sweet Scent, Knock Off, Seed Bomb, Snore, Synthesis, Cross Poison, Hyper Beam, Giga Impact, Throat Chop"
Venonat,Bug,Poison,60,55,50,40,55,45,305,60,59,"Tackle, Confusion, Poison Powder, Psybeam, Stun Spore, Signal Beam, Sleep Powder, Leech Life, Zen Headbutt, Poison Fang, Psychic, Toxic, Venoshock, Hidden Power, Protect, Solar Beam, Leech Life, Double Team, Sludge Bomb, Façade, Rest, Round, Infestation, Sleep Talk, Confide, Agility, Bug Bite, Giga Drain, Morning Sun, Screech, Signal Beam, Toxic Spikes, Snore, Zen Headbutt"
Venomoth,Bug,Poison,70,65,60,90,75,90,450,48,51,"Gust, Quiver Dance, Bug Buzz, Silver Wind, Tackle, Confusion, Poison Powder, Psybeam, Stun Spore, Signal Beam, Sleep Powder, Leech Life, Zen Headbutt, Poison Fang, Psychic, Toxic, Venoshock, Hyper Beam, Hidden Power, Protect, Roost, Solar Beam, Double Team, Sludge Bomb, Aerial Ace, Facade, Rest, Round, Energy Ball, Acrobatics, Giga Impact, Infestation, Sleep Talk, U-turn, Confide, Agility, Bug Bite, Giga Drain, Morning Sun, Screech, Signal Beam, Toxic Spikes, Defog, Snore, Tailwind"
